article_id,outlet,filename,filepath,raw_text,n_chars,n_words
CNN_0025,CNN,cnn_9_May25.txt,/Users/priyamchhonkar/Desktop/hw5-NLP/data_100/cnn_five_para/cnn_9_May25.txt,"Tuesday's shooting at a Texas elementary school, which has left at least 19 children and two adults dead, marked another instance of a uniquely American tragedy.

The shooting is the latest entry in the long history of gun violence in the United States. Before Tuesday, there had been at least 39 shootings in K-12 schools, colleges and universities in 2022, resulting in at least 10 deaths and 51 injuries.

While proposals to overhaul gun laws -- such a ban on assault-style weapons or high-capacity magazines -- face steep odds at the federal level, there are some areas of bipartisan agreement. Whether that's enough to break congressional gridlock is yet to be seen.

Here's what to know about what is being considered in Congress and where it stands.

A House-passed bill, HR 1446, backed by Democratic Rep. Jim Clyburn of South Carolina, would close what's known as the ""Charleston loophole,"" which allows some licensed gun sales to go through before a required background check is done.",994,165
Fox_0001,Fox,FOX_10_May24.txt,/Users/priyamchhonkar/Desktop/hw5-NLP/data_100/FOX_five_para/FOX_10_May24.txt,"Criminal justice expert Darrin Porcher assessed how politicians and law enforcement can better reinforce soft targets to preventmass shootings in the wake of the tragedy at Robb Elementary School in Uvalde, Texas, Tuesday on ""Jesse Watters Primetime.""

DARRIN PORCHER: This is a very unfortunate narrative, however, it keeps repeating itself — it's somewhat repetitive. As modern-
day law enforcement, we’re really great on the response, however, the problem that we have is fortification and omnipresence onsoft targets such as this school… The school resource officers on many occasions are not equipped with firearms for theseelementary schools. That needs to change. The dynamic of these mass shootings is becoming more and more prevalent in oursociety, however, we have our elected officials that come on television, they jump up and down, but there is no execution strategybecause we have a flawed purpose in how we protect these elementary schools.

UVALDE, TEXAS SCHOOL SHOOTING: 18 STUDENTS, ONE ADULT KILLED, SUSPECTED SHOOTER DEAD

It goes back to why did we not have a police officer, meaning an armed resource officer, at the front of this school? When we look ata lot of these mass shootings that have happened in many places throughout the country, it’s the same thing. Oftentimes bad guyswill go the other way when they see a good guy with a gun in front of a school. But, at the same token we still don’t get it. I’m notsaying that we need to arm these schools with Sherman tanks, but, at the same token, we need to understand the narrative of ourschool system is not being protected the way it should be. Unfortunately, this is an example of how it manifests when we areunprepared.",1699,282
Fox_0002,Fox,FOX_1_May24.txt,/Users/priyamchhonkar/Desktop/hw5-NLP/data_100/FOX_five_para/FOX_1_May24.txt,"A mass shooting at a Texas elementary school killed 19 children and two teachers Tuesday and the suspected gunman was killed,Gov. Greg Abbott said.
Abbott identified the suspect as Salvador Ramos, a Uvalde resident, who is also dead and acted alone, authorities said. He had ahandgun and possibly a rifle when he opened fire at Robb Elementary School, he said. Two police officers were shot and woundedbut were expected to survive, Abbott said. 
""Texans across the state are grieving for the victims of this senseless crime and for the community of Uvalde. Cecilia and I mournthis horrific loss and we urge all Texans to come together to show our unwavering support to all who are suffering,"" he said in astatement. 
The shooter was likely killed by responding officers, but the investigation was still ongoing, authorities said. 
A law enforcement officer helps people cross the street at Uvalde Memorial Hospital after a shooting was reported earlier in the day at RobbElementary School on Tuesday.",1000,163
Fox_0003,Fox,FOX_2_May24.txt,/Users/priyamchhonkar/Desktop/hw5-NLP/data_100/FOX_five_para/FOX_2_May24.txt,"There were 61 active shooter incidents reported in the U.S. in 2021 – a nearly 53% increase, or a jump of 21 events, from 2020, theFBI has found.

There were 52.5% more active shooter incidents between 2020 and 2021, and 33% more from 2019 to 2020, according to an FBIreport released Monday, titled ""Active Shooter Incidents in the United States in 2021.""

The report was released just over a week after upstate New York man Payton Gendron, 18, allegedly unleashed a racially motivedattack on May 15, when he opened fire at a busy Tops Friendly Markets store in Buffalo, N.Y. Gendron killed 10 people andwounded three others, officials have said. 

Eleven of the victims were Black individuals. The deceased victims have been identified as: Roberta A. Drury, 32; Margus D.
Morrison, 52; Andre Mackneil, 53; Aaron Salter, 55; Geraldine Talley, 62; Celestine Chaney, 65 ; Heyward Patterson, 67; KatherineMassey, 72; Pearl Young, 77; and Ruth Whitfield, 86.

The May 15 massacre is not included in the FBI’s recent report, which examines statistics only from 2021 and earlier. The bureaudefined an ""active shooter"" as being ""one or more individuals actively engaged in killing or attempting to kill people in a populatedarea.""",1223,200
Fox_0004,Fox,FOX_3_May24.txt,/Users/priyamchhonkar/Desktop/hw5-NLP/data_100/FOX_five_para/FOX_3_May24.txt,"President Biden is set to address the nation after a horrific shooting in Uvalde, Texas left 14 children and one teacher dead.

Biden will speak at 8:15 PM EST on the tragedy that has devastated the town outside of San Antonio, Texas, and shocked thecountry.

The president also issued a proclamation ordering all flags be flown at half-staff on Saturday. 

Law enforcement personnel stand outside Robb Elementary School following a shooting, Tuesday, May 24, 2022, in Uvalde, Texas.

Law enforcement personnel walk outside Uvalde High School after shooting a was reported earlier in the day at Robb Elementary School, Tuesday, May 24, 2022, in Uvalde, Texas.

Texas Governor Greg Abbott said that 14 elementary school students and one teacher from the Robb Elementary School in Uvaldehad died after the suspect, who the governor identified as local resident Salvador Romas, attacked the school.",895,142
Fox_0005,Fox,FOX_4_May24.txt,/Users/priyamchhonkar/Desktop/hw5-NLP/data_100/FOX_five_para/FOX_4_May24.txt,"Vice President Kamala Harris called on leaders to take action following the deadly mass shooting at an elementary school inUvalde, Texas, Tuesday.

""Every time a tragedy like this happens, our hearts break and our broken hearts are nothing compared to the broken hearts of thosefamilies,"" Harris said.

Harris, who was speaking at an Asian Pacific American Institute for Congressional Studies (APAICS), urged leaders to take action.

Law enforcement personnel stand outside Robb Elementary School following a shooting, Tuesday, May 24, 2022, in Uvalde, Texas.

""Enough is enough. As a nation, we have to have the courage to take action and understand the nexus between what makes forreasonable and sensible public policy to ensure something like this never happens again,"" Harris said.

Harris referred to the recent mass shootings in Buffalo, New York, as well as Laguna Woods, California and Dallas, stating thatthere was a ""new sense of urgency"" to take a stand against evil in America. ""Today, we are witnessing again and again the terribleconsequences of hate and the consequences of violence,"" Harris said.",1112,174
Fox_0006,Fox,FOX_5_May24.txt,/Users/priyamchhonkar/Desktop/hw5-NLP/data_100/FOX_five_para/FOX_5_May24.txt,"The Uvalde Consolidated Independent School District (UCISD) in Texas had many security measures in place before Tuesday'smass shooting that left at least 18 students and a teacher dead after a now-deceased suspect opened fire at Robb ElementarySchool. 

The now-deceased suspect, Salvador Romas, is accused of entering school grounds on Tuesday and opening fire, according toTexas Gov. Greg Abbott. 

UCISD's website states that the district has ""proponents to curb and/or eliminate"" elements of"" violence, vandalism, disruptions andfear"" in its schools to ""provide a safe and secure environment for all."" 

Those proponents include four officers, including a chief, a detective and two officers within the school district; partnerships withlocal law enforcement agencies; security staff that patrols door entrances and parking lots at secondary campuses; case managersand social workers on UCISD campuses; licensed counselors; threat assessment teams; social media threat monitoring; a visitormanagement security system; canine detection services; motion detectors and alarm systems; perimeter fencing at Robb and otherschools; security vestibules and outside buzz-in systems; security cameras; a locked classroom door policy; staff and studenttraining; and a threat reporting system. 

The district states that it uses a service called Social Sentinel ""to monitor all social media with a connection to Uvalde as a measureto identify any possible threats that might be made against students and or staff within the school district.""",1533,218
Fox_0007,Fox,FOX_6_May24.txt,/Users/priyamchhonkar/Desktop/hw5-NLP/data_100/FOX_five_para/FOX_6_May24.txt,"Democrats rushed to capitalize on the mass shooting at Robb Elementary School in Uvalde, Texas, on Tuesday to demand guncontrol measures and attack Republicans. 

Texas Gov. Greg Abbott identified the deceased suspect as Salvador Ramos, 18, who had a handgun and possibly a rifle when heopened fire at Robb Elementary School, killing 18 students and one teacher, according to Abbott. Two police officers were shot andwounded but were expected to survive, the governor said. 

Prominent Democrats immediately blamed Republicans for the shooting, with at least one hurling profanities at multipleRepublicans. 

""F--- your prayers. They haven’t worked for the last 20 mass shootings how about passing laws that will stop these killings,"" Rep.
Ruben Gallego, D-Ariz., tweeted at Rep. Darrell Issa, R-Calif. 

A law enforcement officer speaks with people outside Uvalde High School after shooting a was reported earlier in the day at Robb Elementary School, Tuesday, May 24, 2022, in Uvalde, Texas.",993,152
Fox_0008,Fox,FOX_7_May24.txt,/Users/priyamchhonkar/Desktop/hw5-NLP/data_100/FOX_five_para/FOX_7_May24.txt,"Harold Ford Jr. weighed in on how public officials should respond following the Texas school shooting on ""Special Report.""

HAROLD FORD JR.: One of the things public officials have to—be it law enforcement or those elected to public office—have toponder at this moment is what can be done differently and what can be done as fast as possible. First, we need to get to the bottomof what happened here in this situation. 

UVALDE, TEXAS SCHOOL SHOOTING: 14 STUDENTS, ONE TEACHER KILLED, SUSPECTED SHOOTER DEAD, GOV.
ABBOTT SAYS 

I think we have to be willing to confront the conversation around guns and figure out if there are things, sensible things that we cando. Of course, it's a hard charge and highly politicized conversation at times, but one thing we know for certain and I think that yourlast guest, the former D.C. police detective, said it early, there are too many guns on the streets. This is not a statement about theSecond Amendment. 

This is just a statement that..too many of the wrong people have guns in their hands. And how are homeless people and othersgetting guns in their hands when they can't feed themselves and can't support themselves, but somehow or another can find themoney to buy a gun? Again, we need to get to the bottom of all this.",1268,219
Fox_0009,Fox,FOX_8_May24.txt,/Users/priyamchhonkar/Desktop/hw5-NLP/data_100/FOX_five_para/FOX_8_May24.txt,"Former FBI deputy assistant director Danny Coulson advocated for armed police officers in schools in the wake of the shooting atRobb Elementary School in Uvalde, Texas, Tuesday on ""Jesse Watters Primetime.""

DANNY COULSON: I guess you had on the SWAT team commander from Oklahoma, I think. He talked about what they do.
Something much better than that is to have armed police officers inside the school protecting our kids. Seven of my eightgrandchildren are in schools in Texas, and they're this age. We just gave $40 billion to Ukraine. Why don't we allocate money toprotect our own citizens, to put policemen in our schools, to protect our children from these monsters?… I'm really angry about this.
I'm saddened. And frankly, I'm a lot afraid. 

UVALDE, TEXAS SCHOOL SHOOTING: 18 STUDENTS, ONE ADULT KILLED, SUSPECTED SHOOTER DEAD

I was in the business of rescuing people from situations like this. It's a lot better to be inside keeping the bad guys out than trying togo in and find the bad guys. And why don't we do that? We have the money. And one of the things that's important to remember, thegun genie is out of the bottle. You can outlaw guns tomorrow; they're still out there. And we need to protect ourselves. We need tohave courage to bring in policemen [who] will risk their lives and save our children and put a stop to this stuff. Stop it before they getthrough the front door.",1395,242
Fox_0010,Fox,FOX_9_May24.txt,/Users/priyamchhonkar/Desktop/hw5-NLP/data_100/FOX_five_para/FOX_9_May24.txt,"President Biden called for changes to gun laws Tuesday and expressed his heartbreak in his address to the nation following a massshooting at an elementary school in Uvalde, Texas.

""To lose a child is like having a piece of your soul ripped away,"" said Biden, who learned of the shooting at Robb Elementary Schoolwhile on Air Force One returning from his trip to Asia. ""There's a hollowness in your chest, you feel like you're being sucked into it,
never able to get out. Suffocating. It's never quite the same.""

A shooter identified as Salvador Romas opened fire at Robb Elementary School Tuesday, killing at least 18 students and oneteacher. The gunman also died. Two police officers were shot and wounded but were expected to survive, Texas Gov. Greg Abbottsaid. 

President Joe Biden makes a statement about the school shooting in Uvalde, Texas shortly after his return from South Korea and Japan, at the White House, May 24, 2022.

""The Lord is near to the brokenhearted and saves the crushed in spirit,"" Biden said, quoting Psalm 34. Biden asked for prayers forthe families and friends of the children but then turned to call for more restrictive gun laws.",1163,197
Fox_0011,Fox,Fox_11.txt,/Users/priyamchhonkar/Desktop/hw5-NLP/data_100/FOX_five_para/Fox_11.txt,"Former Trump counselor Kellyanne Conway discussed Vice President Kamala Harris addressing America after the tragedy at RobbElementary School in Uvalde, Texas, and how President Biden should respond Tuesday on ""Jesse Watters Primetime.""

KELLYANNE CONWAY: The president has a very high bar tonight because right now the country doesn't have faith in him. Theydon't think he's competent. They don't think he's compassionate. So he really needs to pull deeply, I think be more Sen. Joe Bidenthan President Joe Biden, who is much more congenial, much more, I think, bipartisan, when he needed to be and to understandthat presidents, as President Trump did when Parkland happened on Valentine's Day that year, you have to first show the empathythat you're grieving with the community. 

TEXAS SCHOOL SHOOTING: LIVE UPDATES

You've called the governor and local officials. You're thanking the first responders, the teachers, the parents. Nothing can ever bringyour children back. You have to really dig deeply. But the other thing that President Trump said that I think is important is the resolveof what the federal government can do and cannot do. So we're going to work with the state and local authorities. We're going towork with the attorneys general. You're going to get to the root causes of what happened here.",1313,209
Fox_0012,Fox,Fox_12.txt,/Users/priyamchhonkar/Desktop/hw5-NLP/data_100/FOX_five_para/Fox_12.txt,"As the news of a mass shooting at an elementary school in Uvalde, Texas, on Tuesday continues to travel far and wide, faithleaders across the nation are sharing their reactions, prayers, words and insights with Fox News Digital.

They're also calling out moral rot when they see it.

A suspected lone gunman took the lives of at least 19 children and two teachers; the gunman has been killed, Texas Gov. GregAbbott said on Tuesday. 

""Texans across the state are grieving for the victims of this senseless crime and for the community of Uvalde,"" the governor said ina statement. ""Cecilia and I mourn this horrific loss … We urge all Texans to come together to show our unwavering support to allwho are suffering.""

TEXAS SCHOOL SHOOTING: LIVE UPDATES

The shooting on Tuesday was the deadliest shooting at an elementary school since Sandy Hook in Newtown, Connecticut, in 2012.",877,147
Fox_0013,Fox,Fox_13.txt,/Users/priyamchhonkar/Desktop/hw5-NLP/data_100/FOX_five_para/Fox_13.txt,"Salvador Ramos, the alleged gunman accused of shooting his grandmother and then targeting dozens of victims – ultimately killing19 children and two adults – at a Texas elementary school was known to be a loner who had quit his job just weeks beforeunleashing his attack, Fox News has learned. 

Ramos, an 18-year-old Uvalde, Texas, resident, legally purchased two AR-platform rifles on May 17 and May 20, and bought 375rounds of ammunition on May 18, Texas Sen. John Whitmire told Fox affiliate KCPQ-TV, citing a briefing from the Bureau ofAlcohol, Tobacco, Firearms and Explosives.

Salvador Ramos Texas school shooter

Salvador Ramos suspected vehicle crash before Uvalde Texas elementary school shooting

A police vehicle is seen parked near of a truck believed to belong to the suspect of a shooting at Robb Elementary School in Uvalde, Texas, onTuesday, May 24. (Reuters/Marco Bello)


On Tuesday, Ramos was involved in a domestic disturbance with his grandmother at his grandparents’ Uvalde home, when he shotthe woman in the face and seriously injured her before fleeing, according to authorities. 

TEXAS SCHOOL SHOOTING: LIVE UPDATES

He then crashed his vehicle near Robb Elementary School in Uvalde, authorities said. Local police received a call about ""a crashedvehicle and an individual armed with a rifle making his way into the school,"" DPS Lt. Chris Olivarez told ""Fox & Friends"" onWednesday.",1408,221
Fox_0014,Fox,Fox_14.txt,/Users/priyamchhonkar/Desktop/hw5-NLP/data_100/FOX_five_para/Fox_14.txt,"Former FBI investigator Bill Daly joined ""The Five"" to discuss Tuesday's school shooting at Robb Elementary School and actionsthe country can take to better secure America's schools. 

BILL DALY: You know, do we need to do more in the way of fortification of our schools, even in the more smaller, you know,
primary schools, as opposed to what we to focus only on the high schools or even colleges where they feel as though students maycarry weapons and come in and not that outsiders burst into a school. We need to look at something more like this. It's very tragic tothink that we don't have all the answers right now. You know, this is also been, I think, something that I guess fortunately because ofCOVID, there was a bit of a hiatus, right. People weren't in school. So we didn't have these concerns. And now with everyonecoming back and being back full time in school, now for almost a year and going into next year, maybe it's something we need tolook at with regard to let's revisit this. Let's revisit to a training, the perimeter security around schools because that's the lastoffense. 

You know, we try to get our hands around all these things that happen out there from and a sociological standpoint, from apsychological standpoint, from a behavioral standpoint, what happens in the community kind of help this person before they commitan act. But do we need to focus more on securing that perimeter, kind of providing kind of a ring of steel around these veryimportant locations where we have our young treasures learning? And what do we need to do there? From physical security,
presence of police or security officers, and then training of students and teachers, no matter how young there may be, that may besomething that saves their life.",1758,303
Fox_0015,Fox,Fox_15.txt,/Users/priyamchhonkar/Desktop/hw5-NLP/data_100/FOX_five_para/Fox_15.txt,"President Biden spent only a few seconds at the beginning of his remarks responding to the Uvalde, Texas school shooting beforedetouring into a political exploitation of the tragedy, independent journalist Glenn Greenwald told Fox News on Tuesday.

Greenwald noted how Biden began with a proper, emotional response to the tragic loss of life, but quickly pivoted to blaming the""gun lobby"" for the mass shooting allegedly committed by now-deceased suspect Salvador Ramos.

""As a nation we have to ask when are we going to stand up to the gun lobby – when in God's name are we going to do what weknow needs to be done?"" Biden fumed.

On ""Tucker Carlson Tonight,"" Greenwald said Biden began to express how he sadly could twofold empathize with parents forced tobury a child – referencing the loss of daughter Naomi and first wife Neilia Hunter Biden in a 1972 Hockessin, Del. car wreck -- anddecades later losing his eldest son Joseph Biden III to cancer.

People react following a deadly school shooting in Uvalde, Texas (AP/Dario Lopez-Mills)",1041,173
Fox_0016,Fox,Fox_16.txt,/Users/priyamchhonkar/Desktop/hw5-NLP/data_100/FOX_five_para/Fox_16.txt,"Lieutenant Gov. Dan Patrick reflected on the Texas elementary school shooting that left at least 19 children dead Tuesday on""Tucker Carlson Tonight.""

DAN PATRICK: Tucker, since I was elected back with Greg Abbott back in 2014, this is now the fourth major mass shooting thatwe've had. We had Sutherland Springs, the church. We had the Walmart in El Paso, Odessa and then...four years ago and oneweek, we had the shooting at Santa Fe, where we lost eight students and two teachers, and I will tell you, Tucker, that I've been to alot of funerals, a lot of services, a lot of hospitals, nothing compares to what Bill [Melugin] just said about the loss of a child. And Ithink when crimes like this happen, this is pure evil, that it impacts a whole nation. 

UVALDE, TEXAS SCHOOL SHOOTING: 18 STUDENTS, ONE ADULT KILLED, SUSPECTED SHOOTER DEAD 

Every parent, every grandparent that has a child envisions what they would feel if it happened to them. This is something that goesto the core of our soul, all of us, and I hope the president tries to unify, not divide us on this, because we as a nation will alwaysremember this. 

These children at this school, as adults, one day, will never forget it. These teachers, this community of 16,000 — the school systemonly had 4,000 students in the entire system — Tucker. So, these are crimes that get to the very core of who we are as people and Ithink as people, we have to look internally and ask how did we get here?",1462,261
Fox_0017,Fox,Fox_17.txt,/Users/priyamchhonkar/Desktop/hw5-NLP/data_100/FOX_five_para/Fox_17.txt,"Two Robb Elementary School students who were missing hours after a horrific shooting at the school are among the 22 people whowere killed, the families say.

The whereabouts of Elijah Cruz Torres, 10, were unknown in the aftermath of the second-deadliest mass shooting of a school inU.S. history since Sandy Hook Elementary. Her family confirmed the worst to Fox News Wednesday.

Annabelle Guadalupe Rodriguez, 10, who did not make contact with her family in the hours after suspected gunman SalvadorRamos, a student of Uvalde High School, carried out his shooting spree, was also among those who died, her father told Fox 7Austin.

Elijah Cruz Torres, a 10-year-old student at Robb Elementary School, is still missing following a shooting incident on May 24, 2022.

Several dozen family members were gathered at a local recreation center near Robb Elementary School Tuesday, which served asa reunification center, as their children were also missing.",951,150
Fox_0018,Fox,Fox_18.txt,/Users/priyamchhonkar/Desktop/hw5-NLP/data_100/FOX_five_para/Fox_18.txt,"President Biden incorrectly blamed ""the gun lobby"" for the Uvalde, Texas school shooting, former Secret Service Agent DanBongino said, while correspondent-at-large Geraldo Rivera posited Americans who aren't old enough to buy alcohol shouldn't beallowed to purchase rifles.

The suspect in the shooting, Salvador Ramos, was 18.

Bongino told ""Hannity"" on Tuesday that Biden proved it is already too late not to politicize tragedy, saying the president's nighttimeremarks could've been a healing moment, but were instead another example of intentional division.

""In a moment where he could have been a great healer and unifier, he chose that moment to start screaming at Americans and thegun lobby who had nothing to do with,"" he said, noting oft-invoked public advocacy groups like the Virginia-based National RifleAssociation were not involved in the attack despite politicized suggestions to the contrary.

U.S. President Joe Biden makes a statement about the school shooting in Uvalde, Texas shortly after Biden returned to Washington from his trip to South Korea and Japan, at the White House in Washington, U.S. May 24, 2022.",1131,173
