article_id,outlet,filename,filepath,raw_text,n_chars,n_words
CNN_0001,CNN,cnn_10_May25.txt,/Users/priyamchhonkar/Desktop/hw5-NLP/data_100/cnn_five_para/cnn_10_May25.txt,"Nineteen children and two adults were on the brink of celebrating the end of the school year at Robb Elementary School when a gunman came in and opened fire, stealing their lives and devastating a nation.

For hours, families waited in agony to learn whether their loved ones had survived Tuesday's attack in Uvalde, Texas.

LIVE UPDATES: Deadly shooting at Texas elementary school

Relatives embarked on the grim task of providing DNA swabs to help investigators determine whether their family member was among the victims.

As of Wednesday morning, at least three families said they received devastating news. Here's what relatives want everyone to remember about the people they lost:",687,110
CNN_0002,CNN,cnn_11_May24_replacement.txt,/Users/priyamchhonkar/Desktop/hw5-NLP/data_100/cnn_five_para/cnn_11_May24_replacement.txt,"Two days before the start of summer break, an 18-year-old man opened fire at an elementary school in Uvalde, Texas, on Tuesday, killing 14 students and one teacher, Gov. Greg Abbott said.

The alleged shooter, who also died, is believed to have shot his grandmother before going to the school, three law enforcement sources told CNN.

Uvalde Consolidated Independent School District police Chief Pete Arredondo said the gunman is believed to have acted alone. Arredondo declined to provide further details or take questions from reporters.

The suspected shooter was identified as Salvador Ramos, of Uvalde, according to officials.

""It's believed that he abandoned his vehicle and entered into the Robb Elementary School in Uvalde with a handgun and he may have also had a rifle, but that is not yet confirmed according to my most recent report. He shot and killed, horrifically, incomprehensively, 14 students and killed a teacher,"" he said.",943,151
CNN_0003,CNN,cnn_12_May25.txt,/Users/priyamchhonkar/Desktop/hw5-NLP/data_100/cnn_five_para/cnn_12_May25.txt,"Yeezy Gap has postponed the launch of its Balenciaga collection following the deadly shooting at a Texas elementary school.

The company posted a message on its website Wednesday morning: ""In light of the tragedy in Uvalde, Texas, we are postponing the Yeezy Gap Engineered by Balenciaga launch until Friday, May 27. As we pause, our hearts go out to the families and communities impacted.""

An 18-year-old gunman on Tuesday fatally shot 19 children and two adults at an elementary school in Uvalde, Texas, before he was killed by law enforcement officers, officials said.

Tuesday's massacre is the second-deadliest school shooting since 2012, when 26 children and adults were killed at Sandy Hook Elementary School. It is at least the 30th shooting at a K-12 school in 2022, according to a CNN tally.

LIVE UPDATES: Deadly shooting at Texas elementary school

Products from the ""Yeezy Gap Engineered By Balenciaga"" collection had been set to launch for purchase on Wednesday morning on Yeezygap.com and Balenciaga online partners farfetch.com, mytheresa.com and luisaviaroma.com. The collection pairs Kanye West's creative vision with Balenciaga's creative director, Demna Gvasalia, who has been designing ready-to-wear clothing for Balenciaga for six years.",1260,193
CNN_0004,CNN,cnn_13_May25.txt,/Users/priyamchhonkar/Desktop/hw5-NLP/data_100/cnn_five_para/cnn_13_May25.txt,"Just before killing 19 children and two teachers in a Texas elementary school Tuesday, the 18-year-old gunman allegedly texted a girl who lives in Germany about his intentions.

According to screenshots reviewed by CNN and an interview with the 15-year-old girl -- who said she had been in contact with the gunman for weeks -- Ramos complained about his grandmother being ""on the phone with AT&T abojt (sic) my phone.""

""It's annoying,"" he texted.

Six minutes later, he texted: ""I just shot my grandma in her head."" Seconds after that, he said, ""Ima go shoot up a(n) elementary school rn (right now).""

The last message was sent at 6:21 p.m. Central European Time, which was 11:21 a.m. in Texas.",696,119
CNN_0005,CNN,cnn_14_May25.txt,/Users/priyamchhonkar/Desktop/hw5-NLP/data_100/cnn_five_para/cnn_14_May25.txt,"Nineteen children and two teachers were close to celebrating the end of the school year at Robb Elementary School when a gunman came in and opened fire, stealing their lives and devastating a nation.

For hours, families waited in agony to learn whether their loved ones had survived Tuesday's attack in Uvalde, Texas.

LIVE UPDATES: Deadly shooting at Texas elementary school

Relatives embarked on the grim task of providing DNA swabs to help investigators determine whether their family member was among the victims.

As of Wednesday morning, at least five families had said they received devastating news. Here's what relatives want everyone to remember about the people they lost:",685,109
CNN_0006,CNN,cnn_15_May25.txt,/Users/priyamchhonkar/Desktop/hw5-NLP/data_100/cnn_five_para/cnn_15_May25.txt,"Kaitlin Marie Armstrong, the woman suspected of fatally shooting elite cyclist Anna Moriah ""Mo"" Wilson in Texas, is believed to have traveled to New York City after the killing, authorities said Wednesday.

Armstrong, 34, accused in the May 11 shooting of Wilson -- who had previously dated Armstrong's boyfriend -- in what investigators believe may have been a deadly act of romantic jealousy. A homicide warrant was issued for Armstrong on May 17.

On the night of the killing, Wilson was staying at a friend's house in Austin in preparation for a race, according to an arrest affidavit filed by police in Travis County District Court.

Officers went to the home shortly before 10 p.m. to find Wilson suffering from gunshot wounds, according to police. She was pronounced dead at the scene.

Surveillance video shows a vehicle like Armstrong's near the scene of the shooting, according to the affidavit.",905,149
CNN_0007,CNN,cnn_16_May25.txt,/Users/priyamchhonkar/Desktop/hw5-NLP/data_100/cnn_five_para/cnn_16_May25.txt,"President Joe Biden's nominee to run the Bureau of Alcohol, Tobacco, Firearms and Explosives vowed he would not be influenced by political considerations if he secures the job at a Senate confirmation hearing on Wednesday with the nation's attention focused on gun violence after a horrific shooting at a Texas elementary school.

An 18-year-old gunman on Tuesday fatally shot 19 children and two teachers at an elementary school before he was killed by law enforcement officers, officials said. It is the deadliest shooting at a school since the Sandy Hook massacre in Connecticut in 2012 that left 26 people dead, including 20 children aged between 6 and 7 years old.

The tragedy has shocked the nation and ratcheted up the pressure on Congress and the President to take action, though Democrats can do little to pass stricter gun control measures in a 50-50 Senate amid widespread Republican opposition.

Against that backdrop, the Senate Judiciary Committee is considering the nomination of Steve Dettelbach to run the ATF during a hearing on Wednesday.

In remarks before the committee, Dettelbach addressed the school shooting, calling the pain the families and the community now feel ""unimaginable.""",1207,192
CNN_0008,CNN,cnn_17_May25.txt,/Users/priyamchhonkar/Desktop/hw5-NLP/data_100/cnn_five_para/cnn_17_May25.txt,"The suspect who killed 19 kids and two teachers at an elementary school in Uvalde, Texas, was a local high school student with few if any friends who officials said legally purchased two assault rifles and scores of ammo last week for his 18th birthday.

Salvador Ramos was identified as the gunman who stormed into Robb Elementary on Tuesday with an assault rifle and tactical vest, barricaded himself in a classroom of children and opened fire. Responding officers eventually forced their way into the room and fatally shot him.

The heinous attack came just two days before students were set to be released for the summer and left a community and nation asking yet again: Who would do this, and why?

An examination of Ramos' personal background reveals a bullied loner with no criminal history and -- like so many other mass shooters in America -- interest in and access to high-powered firearms and ammunition.

He purchased guns and ammo last week

The suspect's actions leading up to the shooting offer hints at his mindset and plan.",1040,177
CNN_0009,CNN,cnn_18_May25.txt,/Users/priyamchhonkar/Desktop/hw5-NLP/data_100/cnn_five_para/cnn_18_May25.txt,"The National Rifle Association is set to hold its 2022 annual meeting in Houston on Friday, bringing together its top brass and several notable conservatives, including former President Donald Trump, for the first time in three years.

The NRA's annual meeting was canceled in 2020 and 2021 due to the coronavirus pandemic, but this year the organization is moving ahead with its plans, holding the meeting at a time when both gun rights and the organization itself have come under intense scrutiny, especially after a shooting at an elementary school in Uvalde, Texas, left 21 dead.

Here's what we know about the 2022 annual meeting.

When is the meeting?

The NRA's 2022 Annual Meeting & Exhibits is scheduled to take place from May 27-29, according to the event website. The leadership forum, which the organization bills as ""one of the most politically significant and popular events in the country,"" will take place Friday afternoon.",939,154
CNN_0010,CNN,cnn_19_May25.txt,/Users/priyamchhonkar/Desktop/hw5-NLP/data_100/cnn_five_para/cnn_19_May25.txt,"Texas Democratic gubernatorial nominee Beto O'Rourke confronted Texas Republican Gov. Greg Abbott and other officials on Wednesday as they tried to provide updates on Tuesday's deadly shooting at an elementary school in the state.

As O'Rourke, a former congressman who represented El Paso, Texas, and is a former Senate and presidential candidate, interrupted officials, he could be heard saying to those onstage, ""This is totally predictable.""

Among those onstage with Abbott was Texas Republican Sen. Ted Cruz -- who O'Rourke ran against in his unsuccessful 2018 Senate bid.

In the video, Texas Republican Lt. Gov. Dan Patrick is heard telling O'Rourke, ""You're out of line and an embarrassment.""

""Sit down and don't play this stuff,"" Cruz said, shaking his head.",769,120
CNN_0011,CNN,cnn_1_May24.txt,/Users/priyamchhonkar/Desktop/hw5-NLP/data_100/cnn_five_para/cnn_1_May24.txt,"A suspect is in custody after a shooting incident at Robb Elementary School in Uvalde, Texas, left at least two dead and injured 14 people, including students, authorities said.

The Uvalde Consolidated Independent School District (UCISD) posted about an ""active shooter"" at Robb Elementary at 12:17 p.m. local time and said law enforcement was on site.


The suspect was taken into custody as of 1:06 p.m. local time, according to the Uvalde Police Department.

Two have died after the shooting at Robb Elementary School, a spokesperson from Uvalde Memorial Hospital told CNN.

The hospital received 13 children at their facility who were being treated for varying injuries, he said. Two children were transported to San Antonio and another is pending transfer, Tom Nordwick said.",781,124
CNN_0012,CNN,cnn_20_May25.txt,/Users/priyamchhonkar/Desktop/hw5-NLP/data_100/cnn_five_para/cnn_20_May25.txt,"House Sergeant at Arms William J. Walker, one of the top security officials on Capitol Hill, revealed that he does not believe lawmakers should be allowed to carry firearms in the US Capitol Complex, in a new letter provided exclusively to CNN.

""It is my view that the Capitol Complex should be a place where no one carries a firearm unless they are actively engaged in law enforcement or the protection work done by, among others, myself, the U.S. Capitol Police (USCP) the U.S. Secret Service, and the protective details of visiting foreign officials"" Walker wrote.

Walker's comments come one day after a gunman murdered 21 people in a Texas elementary school. It letter was prompted by an April letter from Democratic House Majority Leader Steny Hoyer, who asked Walker for clarity on whether the US Capitol could be made a ""gun-free zone"" with the exception of security personnel.

While firearms are prohibited in the Capitol Complex for most individuals, lawmakers are allowed to carry firearms in office buildings if they are licensed in the District of Columbia. Certain areas however are restricted, such as the House floor.

Walker acknowledged in his letter that his position that lawmakers should be prohibited from carrying firearms in general is not a commonly held belief.",1289,212
CNN_0013,CNN,cnn_21_May25.txt,/Users/priyamchhonkar/Desktop/hw5-NLP/data_100/cnn_five_para/cnn_21_May25.txt,"When Democrat Beto O'Rourke confronted Texas Republican Gov. Greg Abbott during a press conference Wednesday in the wake of a mass school shooting that left 19 children and two adults dead, he was shouted down for making the tragedy political.

""There are family members who are crying as we speak, there are family members whose hearts are broken, there is no words that anybody shouting can come up here and do anything to heal those broken hearts,"" said Abbott. ""We all, every Texan, every American has the responsibility. We need to focus not on ourselves and our agendas.""

This is, of course, the common response when these events happen. Politicians -- usually Republicans -- insist that it's not the time to discuss gun-related public policies after a mass shooting. And that anyone who does so is somehow dishonoring the memories of those who have been lost.

It's time -- actually past time -- to put that way of thinking behind us.

This is not to defend or criticize what O'Rourke did. It is impossible to separate out the fact that he is running against Abbott this year from his decision to confront the governor at a moment when he knew the eyes of Texas and the nation would be on him.",1201,211
CNN_0014,CNN,cnn_22_May25.txt,/Users/priyamchhonkar/Desktop/hw5-NLP/data_100/cnn_five_para/cnn_22_May25.txt,"It is permanent because presidents lack power, while Capitol Hill is paralyzed by minority rule. And federal courts, though poised to give the power back to the people's representatives on abortion, have routinely struck down state laws to reasonably curb gun access.

Part of the country thinks the answer is fewer guns, while another part wants to see more guns everywhere to take down deranged gunmen.

Journalists like me aren't even writing new stories about how little can happen to address the problem. They're regurgitating old ones written after previous shootings because nothing has changed.

RELATED: Gun legislation is stalled in Congress. Here's why that won't change anytime soon

We know that gun violence can happen anywhere because it has happened everywhere. Schools, churches, supermarkets, ball fields, Walmarts. Gun violence targets young children, Black people, Asian Americans, random citizens and politicians from both parties.",952,144
CNN_0015,CNN,cnn_23_May25.txt,/Users/priyamchhonkar/Desktop/hw5-NLP/data_100/cnn_five_para/cnn_23_May25.txt,"Just before killing 19 children and two teachers in a Texas elementary school Tuesday, the 18-year-old gunman allegedly texted a girl who lives in Germany about his intentions.

According to screenshots reviewed by CNN and an interview with the 15-year-old girl -- who said she had been in contact with the gunman for weeks -- Ramos complained about his grandmother being ""on the phone with AT&T abojt (sic) my phone.""

""It's annoying,"" he texted.

Six minutes later, he texted: ""I just shot my grandma in her head."" Seconds after that, he said, ""Ima go shoot up a(n) elementary school rn (right now).""

The last message was sent at 6:21 p.m. Central European Time, which was 11:21 a.m. in Texas.",696,119
CNN_0016,CNN,cnn_24_May25.txt,/Users/priyamchhonkar/Desktop/hw5-NLP/data_100/cnn_five_para/cnn_24_May25.txt,"While the Supreme Court has been working behind closed doors on its first major Second Amendment opinion in more than a decade, three mass shootings have broken the country, including Tuesday's massacre of 19 schoolchildren in Texas.

Closed off from public view, the justices are penning opinions and dissents in a dispute that targets one concealed carry law in New York that is more than a century old. A narrow ruling could impact only a handful of states with similar laws, but a more expansive ruling could open a new chapter in constitutional challenges to gun safety laws across the country.

""As a formal matter, the Supreme Court's ruling on New York's gun law doesn't call into question gun laws restricting types of weapons or sensitive places where individuals can carry guns,"" said Jacob Charles, executive director of the Center for Firearms Law at Duke University School of Law.

""But a broader ruling that changes the way courts evaluate gun laws could call into question a wider array of gun regulations like assault weapons bans and other restrictions like high-capacity magazine bans,"" Charles added.

The deliberations come as the country mourns another tragedy, victims of gun violence plea for more action, and the political branches seem forever divided on a path forward.",1296,212
CNN_0017,CNN,cnn_25_May25.txt,/Users/priyamchhonkar/Desktop/hw5-NLP/data_100/cnn_five_para/cnn_25_May25.txt,"When Democrat Beto O'Rourke confronted Texas Republican Gov. Greg Abbott during a press conference Wednesday in the wake of a mass school shooting that left 19 children and two adults dead, he was shouted down for making the tragedy political.

""There are family members who are crying as we speak, there are family members whose hearts are broken, there is no words that anybody shouting can come up here and do anything to heal those broken hearts,"" said Abbott. ""We all, every Texan, every American has the responsibility. We need to focus not on ourselves and our agendas.""

This is, of course, the common response when these events happen. Politicians -- usually Republicans -- insist that it's not the time to discuss gun-related public policies after a mass shooting. And that anyone who does so is somehow dishonoring the memories of those who have been lost.

It's time -- actually past time -- to put that way of thinking behind us.

This is not to defend or criticize what O'Rourke did. It is impossible to separate out the fact that he is running against Abbott this year from his decision to confront the governor at a moment when he knew the eyes of Texas and the nation would be on him.",1201,211
CNN_0018,CNN,cnn_2_May24.txt,/Users/priyamchhonkar/Desktop/hw5-NLP/data_100/cnn_five_para/cnn_2_May24.txt,"A suspect is in custody after a shooting at an elementary school in Uvalde, Texas, left at least two dead and injured more than a dozen others, including students, authorities said.

The Uvalde Consolidated Independent School District (UCISD) said there was an ""active shooter"" at Robb Elementary School at 12:17 p.m. Tuesday local time and said law enforcement was on site.

The suspect was taken into custody, according to the Uvalde Police Department.

Two people died in the school shooting, and the hospital received 13 children who were being treated for various injuries, said Tom Nordwick, a spokesperson from Uvalde Memorial Hospital. Two children were transported to San Antonio and another is pending transfer, he said.

A man in his 40s was also being treated, he said.",781,127
CNN_0019,CNN,cnn_3_May24.txt,/Users/priyamchhonkar/Desktop/hw5-NLP/data_100/cnn_five_para/cnn_3_May24.txt,"An 18-year-old man opened fire at an elementary school in Uvalde, Texas, on Tuesday, killing 14 students and a teacher, Gov. Greg Abbott said.

The gunman is also dead, he said.

The Uvalde Consolidated Independent School District (UCISD) said there was an ""active shooter"" at Robb Elementary School at 12:17 p.m. Tuesday local time and said law enforcement was on site. The suspect was taken into custody, according to the Uvalde Police Department.

Uvalde Memorial Hospital spokesperson Tom Nordwick earlier said that two people died in the school shooting and that 13 children and a man in his 40s were being treated for injuries.

University Hospital in San Antonio said in a tweet that they received a child and an adult from the school shooting. The adult, a 66-year-old woman, is in critical condition, the hospital said in a tweet.",839,140
CNN_0020,CNN,cnn_4_May24.txt,/Users/priyamchhonkar/Desktop/hw5-NLP/data_100/cnn_five_para/cnn_4_May24.txt,"Eighteen children and one adult were killed in Tuesday's mass shooting in Uvalde, Texas, according to Sgt. Erick Estrada of the Texas Department of Public Safety.

Estrada did not provide any other information on the victims.

Gov. Greg Abbott said earlier Tuesday ""it is believed"" that the shooter, 18-year-old Salvador Ramos, was killed by law enforcement. Estrada confirmed the suspect was killed.

Ramos is believed to have shot his grandmother before going to the school, three law enforcement sources told CNN.

Two days before the start of summer break, an 18-year-old man opened fire at an elementary school in Uvalde, Texas, on Tuesday, killing 14 students and one teacher, Gov. Greg Abbott said.",705,113
CNN_0021,CNN,cnn_5_May24.txt,/Users/priyamchhonkar/Desktop/hw5-NLP/data_100/cnn_five_para/cnn_5_May24.txt,"An 18-year-old gunman on Tuesday fatally shot 18 children and an adult at a Texas elementary school before he was killed by law enforcement officers, officials said.

The shooter -- identified by Texas officials as Salvador Ramos, of Uvalde -- also shot his grandmother before going to the school, three law enforcement sources told CNN. State Sen. Roland Gutierrez told CNN the grandmother was airlifted to San Antonio and ""is still holding on,"" according to information he was given by the Texas Rangers.

The gunman is believed to have acted alone, Uvalde Consolidated Independent School District Police Chief Pete Arredondo said.

The shooting was the deadliest at an elementary school since the Sandy Hook massacre in Connecticut in 2012 that left 26 people dead, including 20 children between 6 and 7 years old.

Here are the latest developments in Tuesday's tragedy:",873,141
CNN_0022,CNN,cnn_6_May25.txt,/Users/priyamchhonkar/Desktop/hw5-NLP/data_100/cnn_five_para/cnn_6_May25.txt,"Just two days before students in a Texas elementary school were set to begin their summer break, a gunman clad in body armor rushed his way into the school and opened fire on classrooms of young children, killing 19 students and two adults, officials said.

The violent act shook a nation already reeling from another mass shooting across the country just 10 days ago. Parents waited late into the night at a nearby civic center to learn whether their children had survived, with some telling CNN they had to give DNA samples to assist authorities in identifying children.

The 18-year-old gunman, who was killed by law enforcement, is believed to have shot his grandmother before driving to the school to carry out to attack, according to the Texas Department of Public Safety.

As he tried to enter the school, he was engaged by school district police officers, but was still able to enter the building and go into multiple classrooms, DPS Sgt. Erick Estrada said. Authorities say he was armed with a rifle and carrying a backpack.

Tuesday's tragic event marks the deadliest school shooting in nearly a decade since 26 children and adults were killed at Sandy Hook Elementary School in 2012. It is also at least the 30th shooting at a K-12 school in 2022, according to a CNN tally.",1284,222
CNN_0023,CNN,cnn_7_May25.txt,/Users/priyamchhonkar/Desktop/hw5-NLP/data_100/cnn_five_para/cnn_7_May25.txt,"Tuesday's shooting at a Texas elementary school, which has left at least 19 children and two adults dead, marked another instance of a uniquely American tragedy.

The shooting is the latest entry in the long history of gun violence in the United States. Before Tuesday, there had been at least 39 shootings in K-12 schools, colleges and universities in 2022, resulting in at least 10 deaths and 51 injuries.

While proposals to overhaul gun laws -- such a ban on assault-style weapons or high-capacity magazines -- face steep odds at the federal level, there are some areas of bipartisan agreement. Whether that's enough to break congressional gridlock is yet to be seen.

Here's what to know about what is being considered in Congress and where it stands.

A House-passed bill, HR 1446, backed by Democratic Rep. Jim Clyburn of South Carolina, would close what's known as the ""Charleston loophole,"" which allows some licensed gun sales to go through before a required background check is done.",994,165
CNN_0024,CNN,cnn_8_May25.txt,/Users/priyamchhonkar/Desktop/hw5-NLP/data_100/cnn_five_para/cnn_8_May25.txt,"Nineteen children and two adults were killed in a mass shooting at an elementary school in Uvalde, Texas, Tuesday in what is now the second deadliest school shooting in the US.

The 18-year-old shooter, identified by officials as Salvador Ramos, was shot and killed by responding law enforcement. He arrived at Robb Elementary School with a long rifle and wearing body armor, according to Sgt. Erick Estrada with the Texas Department of Public Safety.

The school teaches second through fourth grades and had 535 students in the 2020-21 school year, according to state data.

Hours after the shooting Tuesday, parents were desperately waiting at a civic center near the school to find out if their children had survived. Some told CNN they gave their DNA to help identify the victims.

Here's what we know about the shooting, which happened two days before summer break.",870,144
